{
  "run_id": "MODEL-RUN-ID",
  "orchestration_run_id": "ORCHESTRATION-RUN-ID",
  "task_id": "TASK-ID",
  "role": "builder",
  "task_class": "bounded_implementation",
  "provider": "provider-name",
  "model": "model-name",
  "effort": null,
  "started_at": "2026-08-21T12:00:00Z",
  "finished_at": "2026-08-21T12:01:00Z",
  "input_tokens": null,
  "output_tokens": null,
  "cached_tokens": null,
  "estimated_cost_usd": null,
  "actual_cost_usd": null,
  "wall_clock_seconds": 60,
  "first_pass": true,
  "result": "pass",
  "failure_category": null,
  "review_status": "not_reviewed",
  "integration_status": "not_integrated",
  "notes": "Sanitized operational note; no prompts, secrets, or private content."
}
